{
  "$schema": "https://json-schema.org/draft/2020-12/schema",
  "$id": "https://kantobridge.invalid/protocol/export/g3tiles.schema.json",
  "title": "export Gen 3 tileset pair",
  "description": "MG7 G3D: a tileset pair's metatiles: each one's four 8x8 quarters (top left, top right, bottom left, bottom right) in the flattened art (the over, middle and under planes drawn into one; GEN3_BRIDGE_PLAN §10 E5), its behaviour, and whether it draws anything over sprites.",
  "x-export-kind": "g3tiles",
  "type": "object",
  "required": ["id", "mids", "quarters", "beh", "over", "behaviors"],
  "additionalProperties": false,
  "properties": {
    "id": {
      "type": "string",
      "pattern": "^[A-Za-z0-9_]+$",
      "minLength": 1,
      "maxLength": 64,
      "description": "The engine's id of a primary and secondary tileset pair."
    },
    "mids": {
      "type": "array",
      "maxItems": 1024,
      "items": {"type": "integer", "minimum": 0, "maximum": 1023},
      "description": "The pair's metatile ids."
    },
    "quarters": {
      "type": "array",
      "maxItems": 1024,
      "items": {
        "type": "array",
        "minItems": 4,
        "maxItems": 4,
        "items": {"type": "integer", "minimum": 0, "maximum": 1048575}
      },
      "description": "Per metatile (as in mids), its quarters' ids: page * 1024 + index into the g3image pages g3q.<page>."
    },
    "beh": {
      "type": "array",
      "maxItems": 1024,
      "items": {"type": "integer", "minimum": 0, "maximum": 255},
      "description": "Per metatile, its behaviour number."
    },
    "over": {
      "type": "array",
      "maxItems": 1024,
      "items": {"type": "boolean"},
      "description": "Per metatile: part of it is drawn over sprites (roofs, tree tops)."
    },
    "behaviors": {
      "type": "object",
      "additionalProperties": {
        "type": "string",
        "pattern": "^[A-Z0-9_]+$",
        "minLength": 1,
        "maxLength": 64
      },
      "propertyNames": {"pattern": "^[0-9]{1,3}$"},
      "description": "Behaviour number -> MB_* name, for the numbers used here."
    },
    "land": {
      "type": "array",
      "maxItems": 256,
      "uniqueItems": true,
      "items": {"type": "integer", "minimum": 0, "maximum": 255},
      "description": "The behaviour numbers used here whose cells roll land encounters (the engine's own rule: the encounter tile bit without the surfable one), sorted. Left out when the engine's rule could not be read."
    }
  }
}
